{
  "schema": "axm-machine-voice/history-snapshot/0.1",
  "event_id": "history-snapshot-novel-001",
  "source": {"kind": "machine-floor", "id": "main"},
  "activity": {"kind": "activity", "id": "local-monolith-proof"},
  "current": {
    "ref": {"kind": "pattern", "id": "current-timeout"},
    "domain": {"kind": "pattern-domain", "id": "build-failure-shape"},
    "signature": {"error": "timeout", "stage": 2},
    "evidence": [{"kind": "evidence", "id": "current-timeout-log"}]
  },
  "history_scope": {
    "ref": {"kind": "history-scope", "id": "prior-build-events"},
    "complete_for_domain": true,
    "evidence": [{"kind": "evidence", "id": "complete-history-index"}]
  },
  "history": [
    {
      "ref": {"kind": "historical-pattern", "id": "older-crash"},
      "position": 1,
      "domain": {"kind": "pattern-domain", "id": "build-failure-shape"},
      "signature": {"error": "crash", "stage": 2},
      "evidence": [{"kind": "evidence", "id": "older-crash-log"}]
    },
    {
      "ref": {"kind": "historical-pattern", "id": "older-stage-three-timeout"},
      "position": 2,
      "domain": {"kind": "pattern-domain", "id": "build-failure-shape"},
      "signature": {"error": "timeout", "stage": 3},
      "evidence": [{"kind": "evidence", "id": "older-stage-three-log"}]
    }
  ],
  "next_operations": ["inspect", "compare"]
}
